,Plan,Fund_Name,p.a Return,Expense Ratio,Current Val
453,DEBT,Bandhan CRISIL IBX 90:10 SDL Plus Gilt-September 2027 Index Fund,.A.,0.15,.A.
454,DEBT,Nippon India Nifty G-Sec Jun 2036 Maturity Index Fund,.A.,0.16,.A.
455,DEBT,Aditya Birla Sun Life CRISIL IBX 60:40 SDL + AAA PSU Apr 2026 Index Fund,.A.,tio ,.A.
456,DEBT,Axis Long Duration Fund,.A.,tio ,.A.
457,DEBT,HDFC Nifty G-Sec Jun 2027 Index,.A., 0.2,.A.
458,DEBT,UTI CRISIL SDL Maturity April 2033 Index Fund,.A.,tio ,.A.
459,DEBT,SBI Long Duration Fund,.A.,0.22,.A.
460,DEBT,Quant Gilt Fund,.A.,0.51,.A.
461,DEBT,Tata Nifty G-Sec Dec 2029 Index Fund,.A.,tio ,.A.
462,HYBRID,Aditya Birla Sun Life Multi Asset Allocation Fund,.A.,tio ,.A.
463,DEBT,Baroda BNP Paribas Nifty SDL December 2026 Index Fund,.A.,0.15,.A.
464,DEBT,HDFC Long Duration Debt Fund,.A.,0.25,.A.
465,DEBT,Aditya Birla Sun Life CRISIL IBX AAA Mar 2024 Index Fund,.A.,tio ,.A.
466,DEBT,DSP Nifty SDL Plus G-Sec Sep 2027 50:50 Index Fund,.A.,0.15,.A.
467,EQUITY,Kotak Banking & Financial Services Fund,.A.,tio ,.A.
468,EQUITY,Mirae Asset Flexi Cap Fund,.A.,tio ,.A.
469,DEBT,Axis CRISIL IBX 50:50 Gilt Plus SDL September 2027 Index Fund,.A.,tio ,.A.
470,DEBT,PGIM India CRISIL IBX Gilt Index - Apr 2028 Fund,.A.,tio ,.A.
471,DEBT,Nippon India Nifty SDL Plus G-Sec - Jun 2029 Maturity 70:30 Index Fund,.A.,tio ,.A.
472,EQUITY,HDFC MNC Fund,.A.,tio ,.A.
473,DEBT,HDFC Nifty SDL Oct 2026 Index Fund,.A.,tio ,.A.
474,DEBT,HDFC NIFTY G-Sec Jun 2036 Index Fund,.A.,tio ,.A.
